{
  "schema_version": 1,
  "generated_from": "docs/product/inventory/product.yaml",
  "generated_by": "scripts/build-product-inventory.ts",
  "populated_by": "PDA1_PLATFORM_DISCOVERY_AND_EXPERIENCE_AUDIT",
  "populated_on": "2026-07-11",
  "entry_count": 165,
  "entries": [
    {
      "id": "dom-home",
      "name": "Home",
      "section": "domains",
      "status": "live",
      "visibility": "household",
      "purpose": "The calm place a household lands on every visit, telling them how today looks and what is next.",
      "owner": "Colin Clapson",
      "sources": [
        "client/src/pages/home-experience-page.tsx",
        "client/src/App.tsx#L204"
      ],
      "related": [
        "page-home",
        "jrn-first-run",
        "dom-planner"
      ],
      "last_verified": "2026-07-11",
      "version": 1
    },
    {
      "id": "dom-planner",
      "name": "Planner",
      "section": "domains",
      "status": "live",
      "visibility": "household",
      "purpose": "Where a household decides what they are eating this week, day by day and meal by meal.",
      "owner": "Colin Clapson",
      "sources": [
        "client/src/pages/weekly-planner-page.tsx",
        "docs/architecture/capabilities/templates.md"
      ],
      "related": [
        "page-planner",
        "jrn-plan-week",
        "jrn-shop",
        "cap-planner"
      ],
      "last_verified": "2026-07-11",
      "version": 1
    },
    {
      "id": "dom-cookbook",
      "name": "Cookbook",
      "section": "domains",
      "status": "live",
      "visibility": "household",
      "purpose": "The household's own collection of recipes — saved, imported, scanned or spoken — in one place.",
      "owner": "Colin Clapson",
      "sources": [
        "client/src/pages/meals-page.tsx",
        "docs/architecture/capabilities/meals.md"
      ],
      "related": [
        "page-cookbook",
        "page-meal-detail",
        "jrn-add-recipe",
        "cap-meals"
      ],
      "last_verified": "2026-07-11",
      "version": 1
    },
    {
      "id": "dom-shopping",
      "name": "Shopping",
      "section": "domains",
      "status": "live",
      "visibility": "household",
      "purpose": "Turning the week's plan into a shopping trip — one list, real products, ready to hand to a supermarket.",
      "owner": "Colin Clapson",
      "sources": [
        "client/src/pages/shopping-workspace-page.tsx",
        "client/src/pages/shopping-list-page.tsx"
      ],
      "related": [
        "page-shopping-workspace",
        "page-basket",
        "jrn-shop",
        "cap-shopping"
      ],
      "known_defects": [
        "fnd-shopping-duplicate"
      ],
      "last_verified": "2026-07-11",
      "version": 1
    },
    {
      "id": "dom-pantry",
      "name": "Pantry",
      "section": "domains",
      "status": "live",
      "visibility": "household",
      "purpose": "What the household already has at home, so planning and shopping do not buy it twice.",
      "owner": "Colin Clapson",
      "sources": [
        "client/src/pages/pantry-page.tsx"
      ],
      "related": [
        "page-pantry",
        "jrn-stock-pantry",
        "cap-pantry"
      ],
      "last_verified": "2026-07-11",
      "version": 1
    },
    {
      "id": "dom-nutrition",
      "name": "Nutrition",
      "section": "domains",
      "status": "live",
      "visibility": "household",
      "purpose": "An honest picture of how varied and how whole the household's food actually is, and what to try next.",
      "owner": "Colin Clapson",
      "sources": [
        "client/src/pages/plant-diversity-page.tsx",
        "docs/architecture/NK1_CANONICAL_NUTRITION_KNOWLEDGE_PLATFORM.md"
      ],
      "related": [
        "page-nutrition",
        "page-food-detail",
        "jrn-understand-nutrition",
        "cap-nutrition-knowledge"
      ],
      "last_verified": "2026-07-11",
      "version": 1
    },
    {
      "id": "dom-diary",
      "name": "Diary",
      "section": "domains",
      "status": "live",
      "visibility": "household",
      "purpose": "A light, day-by-day record of what the household actually ate — without the burden of a tracking app.",
      "owner": "Colin Clapson",
      "sources": [
        "client/src/pages/food-diary-page.tsx"
      ],
      "related": [
        "page-diary",
        "jrn-track-eaten",
        "cap-diary"
      ],
      "last_verified": "2026-07-11",
      "version": 1
    },
    {
      "id": "dom-analyser",
      "name": "Analyser",
      "section": "domains",
      "status": "live",
      "visibility": "household",
      "purpose": "Scan or search any packaged product to see what is really in it, and find a better choice before buying.",
      "owner": "Colin Clapson",
      "sources": [
        "client/src/pages/products-page.tsx",
        "docs/architecture/capabilities/analyser.md"
      ],
      "related": [
        "page-analyser",
        "jrn-analyse-product",
        "cap-analyser"
      ],
      "last_verified": "2026-07-11",
      "version": 1
    },
    {
      "id": "dom-companion",
      "name": "Apple",
      "section": "domains",
      "status": "live",
      "visibility": "household",
      "purpose": "THA's companion — ask it about your food, your plan or your pantry, and it answers from what THA actually knows.",
      "owner": "Colin Clapson",
      "sources": [
        "client/src/components/conversation/FloatingAssistant.tsx",
        "docs/architecture/THA_COMPANION_PLATFORM_ARCHITECTURE.md"
      ],
      "related": [
        "cap-companion",
        "gls-apple"
      ],
      "known_defects": [
        "fnd-pkr27-prompt-knowledge"
      ],
      "last_verified": "2026-07-11",
      "version": 1
    },
    {
      "id": "dom-household",
      "name": "Household & Profile",
      "section": "domains",
      "status": "live",
      "visibility": "household",
      "purpose": "Who lives here, what each person eats and cannot eat, and how the household wants THA to behave.",
      "owner": "Colin Clapson",
      "sources": [
        "client/src/pages/profile-page.tsx",
        "docs/architecture/capabilities/household.md"
      ],
      "related": [
        "page-profile",
        "cap-household",
        "cap-profile",
        "page-privacy-settings",
        "page-help-centre",
        "page-contact"
      ],
      "last_verified": "2026-07-18",
      "version": 2
    },
    {
      "id": "dom-partners",
      "name": "Partners",
      "section": "domains",
      "status": "live",
      "visibility": "household",
      "purpose": "A reviewed directory of wellness partners and services that support a household beyond the basket.",
      "owner": "Colin Clapson",
      "sources": [
        "client/src/pages/partners-page.tsx",
        "client/src/data/partners.ts"
      ],
      "related": [
        "page-partners",
        "cap-partners"
      ],
      "last_verified": "2026-07-11",
      "version": 1
    },
    {
      "id": "dom-admin",
      "name": "Admin",
      "section": "domains",
      "status": "live",
      "visibility": "admin",
      "purpose": "The operator's view of THA — users, curation, knowledge review, and the intelligence workbenches.",
      "owner": "Colin Clapson",
      "sources": [
        "client/src/pages/admin-page.tsx",
        "client/src/components/admin-banner.tsx"
      ],
      "related": [
        "adm-home",
        "adm-users",
        "cap-administration"
      ],
      "last_verified": "2026-07-11",
      "version": 1
    },
    {
      "id": "dom-trust-and-compliance",
      "name": "Trust & Compliance",
      "section": "domains",
      "status": "live",
      "visibility": "household",
      "purpose": "The policies THA publishes, what it holds about a household, the rights they can exercise over it, and how they reach a person when something is wrong.",
      "owner": "Colin Clapson",
      "sources": [
        "shared/legal/index.ts",
        "shared/privacy/consent.ts",
        "server/privacy/personal-data-registry.ts",
        "server/trust-routes.ts",
        "docs/architecture/THA_TRUST_AND_COMPLIANCE_ARCHITECTURE.md"
      ],
      "related": [
        "page-legal",
        "page-privacy-settings",
        "page-help-centre",
        "page-contact",
        "set-privacy-and-data",
        "hlp-help-centre",
        "dom-commerce"
      ],
      "last_verified": "2026-07-18",
      "version": 1
    },
    {
      "id": "dom-commerce",
      "name": "Plans and Entitlements",
      "section": "domains",
      "status": "live",
      "visibility": "household",
      "purpose": "What each plan includes, what a household is entitled to, and how a subscription would begin, change and end. THA takes NO payments and activates NO subscriptions — the commercial domain exists, the payment provider does not. Pricing is placeholder and is never shown to a household until it is explicitly configured and approved.",
      "owner": "Colin Clapson",
      "sources": [
        "shared/commerce/index.ts",
        "shared/commerce/plans.ts",
        "shared/commerce/entitlements.ts",
        "shared/commerce/subscription.ts",
        "shared/commerce/billing-events.ts",
        "server/commerce/entitlement-service.ts",
        "server/commerce/subscription-store.ts",
        "server/commerce/billing-provider.ts",
        "server/commerce-routes.ts",
        "server/lib/access.ts",
        "client/src/hooks/use-entitlements.ts",
        "server/tests/test-bus2a-commercial-foundation.ts",
        "docs/architecture/THA_COMMERCIAL_ARCHITECTURE.md"
      ],
      "related": [
        "dom-trust-and-compliance",
        "api-surface",
        "routes-map"
      ],
      "last_verified": "2026-07-19",
      "version": 2
    },
    {
      "id": "page-landing",
      "name": "Landing",
      "section": "pages",
      "status": "live",
      "visibility": "public",
      "route": "/",